991011001225504000,9781350033740,1012342731,"Gallagher, Eugene V., author.; Robinson, Joanne Maguire, 1966- author.","The religious studies skills book : close reading, critical thinking, and comparison / Eugene V. Gallagher and Joanne Maguire Robinson.","London, UK ; New York, NY, USA : Bloomsbury Academic, Bloomsbury Publishing Plc, 2019.","viii, 194 pages ; 24 cm",Religion--Study and teaching (Higher)--United States.,,,,,
991011115622604000,9780367031039,1107844106,"Gámez Luis, José L.S., 1966- editor; Lin, Zhongjie, 1973- editor; Nesbit, Jeffrey S., editor.","Rio de Janeiro : urban expansion and environment / edited by José L.S. Gámez, Zhongjie Lin and Jeffrey S. Nesbit.","Abingdon, Oxon ; New York, NY : Routledge, an imprint of the Taylor & Francis Group, 2020.","xiv, 168 pages ; 23 cm.",Urbanization--Brazil--Rio de Janeiro; Megacities--Case studies.,"Rio de Janeiro (Brazil);Barra da Tijuca (Rio de Janeiro, Brazil)",,,,
991011010021504000,9789027202123,1053904175,"Garcés-Conejos Blitvich, Pilar, 1960- editor; Fernández-Amaya, Lucia, editor; De la O Hernandez-Lopez, Maria, editor.","Technology mediated service encounters / edited by Pilar GarceÌs-Conejos Blitvich, LuciÌa FernaÌndez-Amaya, MarÃ¸a de la O HernaÌndez-LoÌpez.","Amsterdam ; Philadelphia : John Benjamins Publishing Company, [2019]",vi; 247 pages 25cm.,Business communication; Intercultural communication; Customer relations; Communication in marketing.,,,,,
991011298489604000,9783631827055,1226762384,"Garcia Leon, Javier E., author.","EspectaÌculo, normalizacioÌn y representaciones otras : las personas transgeÌnero en la prensa y el cine de Colombia y Venezuela / Javier E. GarciÌa LeoÌn.","Berlin ; New York : Peter Lang, [2021]",194 pages ; 22 cm.,Sexual minorities in mass media; Transgender people in motion pictures; Transgender people--Colombia; Transgender people--Venezuela.,,,,,
991011482650504000,9781648028779,1325677740,"Garo, Laurie A., editor; Butler, Bettie Ray, 1981- editor; Lewis, Chance W. (Chance Wayne), 1972- editor.","Un-silencing youth trauma : transformative school-based strategies for students exposed to violence & adversity / Laurie A. Garo, Bettie Ray Butler, Chance W. Lewis.","Charlotte, NC : Information Age Publishing, Inc., [2022]","xxii, 153 pages : illustrations ; 25 cm.","Children with social disabilities--Education--United States; Psychic trauma in children--Treatment--United States; Transformative learning--United States; African American students--Social conditions; Culturally relevant pedagogy--United States; Education, Urban--United States.",,,,,
991001577419704000,9781483385129,910983834,"Gaultney, Jane F.; Peach, Hannah D.","How to do research : 15 labs for the social & behavioral sciences / Jane F. Gaultney, University of North Caroline, Charlotte, Hannah D. Peach, University of North Caroline, Charlotte.","Los Angeles : SAGE Publications, Inc., [2016]","xix, 284 pages : illustrations ; 24 cm",Psychology--Research--Methodology; Social sciences--Research--Methodology.,,,,,
991011141489804000,9780300231298,1089972448,"Gbur, Greg, author.",Falling felines and fundamental physics / Gregory J. Gbur.,"New Haven, CT : Yale University Press, [2019]","xiv, 337 pages : illustrations ; 22 cm",Physics--Miscellanea; Cats--Physiology.,,,,,
991001219749704000,9783319149554,898531836,"Gero, John S.","Design computing and cognition '14 / John S. Gero, Sean Hann, editor.","Cham : Springer, 2015.",682 pages : illustrations ; 25 cm,Computer-aided design--Congresses; Engineering design--Data processing--Congresses; Architectural design--Data processing--Congresses.,,,,,
991002421699704000,3319449885,953843022,"Gero, John S.",Design computing and cognition '16./ edited by John S. Gero.,"Cham, Switzerland : Springer International Pu, 2016.",xiv; 704 pages 24cm.,Architectural design--Data processing--Congresses; Cognition--Congresses; Computer-aided design--Congresses.,,,,,
991011011866304000,3030053628,1061819234,"Gero, John S., editor.","Design computing and cognition '18 / John S. Gero, editor.","Cham, Switzerland, Springer Nature, 2019.",xiv; 740 pages 24cm.,Architectural design--Data processing--Congresses.,,,,,
991011458565204000,3030906248,1274201344,"Gero, John S., editor.","Design computing and cognition '20 / John S. Gero, editor.","Cham, Switzerland : Springer, 2022.","xv, 692 pages : illustrations (some color) ; 24cm",Engineering design--Data processing--Congresses; Architectural design--Data processing--Congresses; Cognition--Congresses; Computer-aided design--Congresses.,,,,,
991011179489804000,9781350109513,1129898894,"Ghazvinian, John, 1974- editor, writer of introduction; Fraas, Arthur Mitchell, editor, writer of introduction.",American and Muslim worlds before 1900 / edited by John Ghazvinian and Arthur Mitchell Fraas.,"London : Bloomsbury Academic, 2020.","vi, 227 pages : illustrations ; 24 cm.",,Islamic countries--Relations--United States.;United States--Relations--Islamic countries.,,,,
991000234369704000,9780071831451,859180876,"Giles, Ranald V.; Evett, Jack B., 1942- author; Liu, Cheng, 1937- author; Giles, Ranald V.--Schaum's outline of fluid mechanics and hydraulics.","Fluid mechanics and hydraulics / Ranald V. Giles, Jack B. Evett, Cheng Liu.","New York : Schaum's Outline Series, 2014.","xiii, 362 pages : illustrations ; 28 cm.","Fluid mechanics; Fluid mechanics--Problems, exercises, etc; Hydraulics; Hydraulics--Problems, exercises, etc.",,,,,
991001216469704000,9781594162305,898425083,"Gillman, Jeff, 1969-, author.","How trees die : the past, present, and future of our forests / Jeff Gillman.","Yardley, Pennsylvania : Westholme Publishing, 2015.",234 pages : illustrations ; 23 cm,Trees; Forests and forestry; Trees--Social aspects; Forests and forestry--Social aspects; Forest ecology; Trees--Environmental aspects; Forests and forestry--Environmental aspects.,,,,,
991011533991904000,9781119834328,1328001937,"Glass, Tehia Starker, author.; Berry, Lucretia Carter, author.","Teaching for justice & belonging : a journey for educators & parents / Tehia Starker Glass, Lucretia Carter Berry.","Hoboken, NJ : Jossey-Bass, a Wiley Brand, [2022]","xi, 180 pages : illustrations ; 23 cm",Social justice--Study and teaching; Anti-racism--Study and teaching.,,,,,
991003117629704000,3319618172,1010269426,"Godev, ConcepcioÌn B., editor.","Translation, globalization and translocation : the classroom and beyond / ConcepcioÌn B. Godev, editor.","Cham : Springer International Publishing, [2017]","xxii, 215 pages : illustrations ; 22 cm.",Translating and interpreting--Congresses; Globalization--Congresses.,,,,,
991009541009704000,9780205958528,828892890,"Goldfield, David R., 1944-","The American journey : a history of the United States / David Goldfield, University of North Carolina, Charlotte ; Carl Abbott, Portland State University ; Virginia DeJohn Anderson, University of Colorado, Boulder ; Jo Anne E. Argersinger, Southern Illinois University ; Peter H. Argersinger, Southern Illinois University ; William L. Barney, University of North Carolina, Chapel Hill.","Boston : Pearson, [2014]","1 volume (various pagings) : illustrations (some color), color maps ; 28 cm",,United States--History--Textbooks.,,,,
991010737187204000,9781620400883,987909544,"Goldfield, David R., 1944-, author.",The gifted generation : when government was good / David Goldfield.,"New York, NY : Bloomsbury USA, an imprint of Bloomsbury Publishing Plc, 2017.","viii, 534 pages, 24 unnumbered pages of plates : illustrations ; 25 cm",Social change--United States--History--20th century; Baby boom generation--Attitudes; Federal government--United States--Public opinion; Public investments--United States--Public opinion; Public opinion--United States.,United States--History--1945-;United States--Social conditions--1945-;United States--Politics and government--1945-1989.;United States--Politics and government--1989-,,,,
991010874257904000,9781138124738,1027787502,"Gonzalez, Ann B., author.",Postcolonial approaches to Latin American children's literature / Ann B. Gonzalez.,"New York : Routledge, Taylor & Fancis Group, 2018.","xiv, 192 pages : illustrations ; 24 cm.","Children's literature, Latin American--History and criticism; Children's literature, Spanish American--History and criticism.",,,,,
991001725889704000,9783319249254,919107252,"Grabchak, Michael, author.",Tempered stable distributions : stochastic models for multiscale processes / Michael Grabchak.,"Cham : Springer Verlag, 2016.",xii; 118 pages ; 24 cm.,Distribution (Probability theory); Stochastic models; LeÌvy processes.,,,,,
991002668119704000,9781439912799,962792730,"Grano, Daniel A.",The eternal present of sport : rethinking sport and religion / Daniel A. Grano.,"Philadelphia : Temple University Press, [2017]","x, 269 pages ; 24 cm",Sports--Religious aspects.,,,,,
991011028089804000,9781433142116,1080248083,"Grano, Daniel A., editor; Butterworth, Michael L., editor.","Sport, rhetoric, and political struggle / edited by Daniel A. Grano and Michael L. Butterworth.","New York, NY : Peter Lang Publishing, Inc., [2019]","xiii, 228 pages ; 23 cm.",Communication in sports--United States; Mass media and sports--United States; Sports--Political aspects--United States; Sports--Social aspects--United States; Athletes--Political activity--United States.,,,,,
991006865919704000,9780820335612,456179357,"Graves, William, 1967-;Smith, Heather A.","Charlotte, NC : the global evolution of a new South city / edited by William Graves and Heather A. Smith.","Athens : University of Georgia Press, Â©2010.","vi, 310 pages : illustrations, maps ; 24 cm",Social change--North Carolina--Charlotte; Urbanization--North Carolina--Charlotte; Globalization--Social aspects--North Carolina--Charlotte; City and town life--North Carolina--Charlotte; Cities and towns--Growth--Case studies; Social change--Southern States--Case studies; Globalization--Social aspects--Southern States--Growth--Case studies; Cities and towns--Southern States--Growth--Case studies.,Charlotte (N.C.)--Economic conditions.;Charlotte (N.C.)--Social conditions.,,,,
991010951184804000,9780367000226,1052900936,"Groenhout, Ruth E., 1962-, author.",Care ethics and social structures in medicine / Ruth E. Groenhout.,"New York : Routledge, 2019.",161 pages ; 24 cm.,Medical ethics.,,,,,
991002259719704000,9780865168350,948878156,"Grote, Dale A., editor.",The vulgate of Mark with the Synoptic parallels / Dale A. Grote.,"Mundelein, Illinois : Bolchazy-Carducci Publishers, Inc., [2016]","xxii, 442 pages : map ; 23 cm",,,,,,"Bible. Mark--Criticism, Redaction.;Bible. Gospels--Criticism, Redaction.;"
991000263729704000,9780062246837,861210110,"Grymes, James A., author.","Violins of hope : violins of the Holocaust, instruments of hope and liberation in mankind's darkest hour / James A. Grymes.","New York : Harper Perennial, [2014]",319 pages : illustrations ; 21 cm,Violinists--Europe--Biography; Jewish musicians--Europe--Biography; Holocaust victims--Biography; Musical instruments--Maintenance and repair--History--20th century.,,,,,
991011289563904000,9781609456184,1139225282,"Gwyn, Aaron, author.",All God's children / Aaron Gwyn.,"New York, NY : Europa Editions, 2020.",389 pages : maps ; 21 cm,Frontier and pioneer life--United States--Fiction; Slavery--United States--Fiction; Fugitive slaves--Fiction; African Americans--Fiction; Liberty--Fiction.,United States--History--1783-1865--Fiction.;Texas--History--19th century--Fiction.,,,,
991000262889704000,9780813049977,861209591,"H. D. (Hilda Doolittle), 1886-1961, author.; Vetter, Lara Elizabeth, 1968- editor.",By Avon River / H.D. ; edited by Lara Vetter.,"Gainesville, FL : University Press of Florida, [2014]","viii, 183 pages ; 24 cm","English poetry--Early modern, 1500-1700; English poetry--Early modern, 1500-1700--History and criticism.",,"Shakespeare, William, 1564-1616--In literature; Shakespeare, William, 1564-1616--Poetry",,,
991001269799704000,9780071822039,900542983,"Hademenos, George J., author.","McGraw-Hill Education MCAT : biological and biochemical foundations of living systems : 2015 / George J. Hademenos, PhD [and six others].","New York : McGraw-Hill Education, [2015]","xxiii, 232 pages : illustrations (some color) ; 28 cm",Biology--Examinations--Study guides; Medical colleges--United States--Entrance examinations--Study guides; Medical College Admission Test--Study guides.,,,,,
991001119859704000,9780071825610,894344800,"Hademenos, George J., author.","McGraw-Hill Education MCAT behavioral and social sciences & critical analysis 2015 / George J. Hademenos, PhD [and 6 others].","New York : McGraw-Hill Education, 2015.","xxv, 241 pages : illustrations ; 28 cm.",Psychology--Examinations--Study guides; Social sciences--Examinations--Study guides; Medical colleges--United States--Entrance examinations--Study guides; Medical College Admission Test--Study guides.,,,,,
991001300889704000,9780071824415,902701518,"Hademenos, George J., author.",MCAT : 2 full-length practice tests / George J. Hademenos [and six others].,"New York : McGraw-Hill Education, 2015.","xxvii, 276 pages : illustrations ; 28 cm.","Medical colleges--United States--Entrance examinations--Study guides; Medicine--Examinations, questions, etc; Medical College Admission Test--Study guides.",,,,,
991001640669704000,1259583813,913924465,"Hademenos, George J., author.; McCloskey Campbell, Candice, author; Murphree, S. Shaun, author; Wachholtz, Amy B., author; Warner, Jennifer M., author; Zahler, Kathy A., author; Evangelist, Thomas A., contributor.","McGraw-Hill Education MCAT 2016 : 2 full-length practice tests / George J. Hademenos, Candice McCloskey Campbell, Shaun Murphree, Amy B. Wachholtz, Jennifer M. Warner, Kathy A. Zahler ; Thomas A. Evangelist, contributor.","New York : McGraw-Hill Education, [2016]","xxvii, 252 pages : illustrations (some color) ; 28 cm","Medical colleges--United States--Entrance examinations--Study guides; Medical College Admission Test--Study guides; Medicine--Examinations, questions, etc.",,,,,
991002040089704000,9781259588372,936357567,"Hademenos, George J., author.; McCloskey Campbell, Candice; Murphree, Shaun.","MCAT chemical and physical foundations of biological systems, 2016 / George J. Hademenos, PhD, Candice McCloskey Campbell, PhD, Shaun Murphree, PhD, Amy B. Wachholtz, PhD, Jennifer M. Warner, PhD, Kathy A. Zahler, MS.","New York : McGraw-Hill Education, [2016]","xxiii, 402 pages : illustration ; 28cm.","Medical colleges--United States--Entrance examinations--Study guides; Medical College Admission Test--Study guides; Medicine--Examinations, questions, etc.",,,,,
991010879283904000,3319713205,1007067785,"Hadžikadić, Mirsad, editor; Avdaković, Samir editor.","Advanced Technologies, Systems, and Applications II : proceedings of the International Symposium on Innovative and Interdisciplinary Applications of Advanced Technologies (IAT) / Mirsad Hadžikadić, Samir Avdaković, editors.","Cham, Switzerland : Springer, 2018.",xiii; 1203 pages 24cm.,Systems engineering--Congresses; Electric power production; Computational intelligence.,,,,,
991011412842404000,9783030882952,1295113359,"Hammelman, Colleen, author.",Greening cities by growing food : a political ecology analysis of urban agriculture in the Americas / Colleen Hammelman.,"Cham, Switzerland : Springer, 2022.","viii, 116 pages : illustrations ; 24 cm",Urban agriculture--America; Sustainable urban development; Urban agriculture--Political aspects--America; Urban gardening--America; Urban ecology (Sociology)--America; Local government and environmental policy--America.,,,,,
991002600719704000,9780807758137,960762437,"Hancock, Dawson R., author.; Algozzine, Robert, author.","Doing case study research : a practical guide for beginning researchers / Dawson R. Hancock, Bob Algozzine.","New York : Teachers College Press, [2017]","xi, 116 pages ; 23 cm",Education--Research--Methodology; Education--Research--Case studies; Case method.,,,,,
991011355330204000,9780807765869,1276793754,"Hancock, Dawson R., author.; Algozzine, Robert, author; Lim, Jae Hoon, author.","Doing case study research : a practical guide for beginning researchers / Dawson R. Hancock, Bob Algozzine, Jae Hoon Lim.","New York : Teachers College Press, [2021]","xiii, 129 pages ; 23 cm",Education--Research--Methodology; Education--Research--Case studies; Case method.,,,,,
991001270619704000,9781623968229,900558912,"Hancock, Stephen D., editor, author; Allen, Ayana, editor, author; Lewis, Chance W. (Chance Wayne), 1972- editor, author.","Autoethnography as a lighthouse : illuminating race, research, and the politics of schooling / edited by Stephen D. Hancock, Ayana Allen, Chance W. Lewis.","Charlotte, NC : Information Age Publishing, Inc., [2015]","vi, 186 pages : illustrations ; 24 cm.",Ethnology--Biographical methods; Ethnology--Authorship; Minorities in higher education--United States; African American women scholars--Social aspects; African American scholars; Hispanic American scholars.,,,,,
991002842699704000,9781681236476,973878732,"Hancock, Stephen D., editor; Warren, Chezare A., editor.","White women's work : examining the intersectionality of teaching, identity, and race / edited by Stephen D. Hancock and Chezare A. Warren.","Charlotte, N.C. : Information Age Publishing, Inc., [2017]","xiii, 206 pages ; 24 cm.","Women teachers, White--United States; Multicultural education--United States; White people--Race identity--United States; Sexism in education--United States; Race awareness--United States.",,,,,
991011024286304000,9781516512461,1002306362,"Harris, Felecia D, author.","What color are your jellybeans? : intersections of generation, race, sex, culture, and gender / by Felecia Carter Harris, Ed.D., University of North Carolina - Charlotte.","[San Diego, Calif.] : Cognella Academic Publishing, [2017]","xiv, 159 pages ; 26 cm",Cultural pluralism; Intersectionality (Sociology),,,,,
991000568879704000,9780719079191,872706073,"Hartley, A. J. (Andrew James), author.",Julius Caesar / Andrew James Hartley.,"Manchester ;$aNew York : Manchester University Press ;$aNew York : Distributed in the United States exclusively by Palgrave Macmillan, 2014.","xi, 258 pages : illustrations ; 23 cm.",,,"Shakespeare, William, 1564-1616. Julius Caesar; Shakespeare, William, 1564-1616--Stage history; Shakespeare, William, 1564-1616--Criticism and interpretation",,,
991002591349704000,9781474220378,960220105,"Hartley, A. J. (Andrew James), author.",Julius Caesar : a critical reader / Andrew James Hartley.,"London : Bloomsbury Arden Shakespeare, 2016.","xiv, 281 pages ; 20 cm.",,,"Shakespeare, William, 1564-1616. Julius Caesar; Shakespeare, William, 1564-1616--Criticism and interpretation",,,
991010871889404000,9781107171725,990970014,"Hartley, A. J. (Andrew James), editor.",Shakespeare and millennial fiction / edited by Andrew James Hartley.,"Cambridge, United Kingdom ; New York : Cambridge University Press, 2018.","xi, 265 pages ; 24 cm",Fiction--21st century--History and criticism.,,"Shakespeare, William, 1564-1616--In literature; Shakespeare, William, 1564-1616--InfluenceShakespeare, William, 1564-1616--Adaptations--History and criticism",,,
991000953129704000,9781107048553,890011344,"Hartley, A. J. (Andrew James), editor.",Shakespeare on the university stage / edited by Andrew James Hartley.,"New York : Cambridge University Press, 2015.","xii, 292 pages : illustrations ; 24 cm",College and school drama--History and criticism.,,"Shakespeare, William, 1564-1616--Dramatic production; Shakespeare, William, 1564-1616--Stage history",,,
991011276145104000,9781350107748,1156421910,"Hartley, A. J. (Andrew James), editor; Holland, Peter, 1951- editor.",Shakespeare and geek culture / edited by Andrew James Hartley and Peter Holland.,"London, UK ; New York, NY : The Arden ShakespeareBloomsbury Pubishing Plc, 2021.","xvi, 317 pages : illustrations ; 23 cm",Popular culture and literature.,,"Shakespeare, William, 1564-1616--Influence; Shakespeare, William, 1564-1616--Appreciation",,,
991010924587804000,9780674972315,1020311612,"Haynes, Christine, 1970-, author.",Our friends the enemies : the occupation of France after Napoleon / Christine Haynes.,"Cambridge, Massachusetts : Harvard University Press, 2018.","404 pages : illustrations, maps ; 25 cm","Napoleonic Wars, 1800-1815--Peace; Military occupation.","France--History--Restoration, 1814-1830.;France--History--Louis XVIII, 1814-1824.;France--Foreign relations--1814-1830.",,,,
991011013281804000,9781522580096,1083152193,"Heafner, Tina L., editor; Hartshorne, Richard, 1971- editor; Thripp, Richard, editor.","Handbook of research on emerging practices and methods for K-12 online and blended learning / Tina Lane Heafner, Richard Hartshorne, and Richard Thripp, editors.","Hershey PA : Information Science Reference, [2019]",xxxviii; 608 pages 29cm.,Computer-assisted instruction; Blended learning; Educational technology.,,,,,
991000698589704000,9781466663831,880239289,"Heafner, Tina L; Hartshorne, Richard, 1971-;Petty, Teresa M.","Exploring the effectiveness of online education in K-12 environments / Tina L. Heafner, Richard Hartshorne, Teresa Petty, [editors].","Hershey, PA : Information Science Reference, [2015]","xxxiii, 481 pages ; 29 cm.","Distance education--United States--Computer-assisted instruction; Internet in education--United States; Web-based instruction--United States; Education, Elementary--Effect of technological innovations on--United States; Education, Secondary--Effect of technological innovations on--United States.",,,,,
991002830149704000,9781438466392,973199429,"Heberlig, Eric S., 1970-, author.; Leland, Suzanne M., 1971- author; Swindell, David, 1966- author.","American cities and the politics of party conventions / Eric S. Heberlig, Suzanne M. Leland, and David Swindell.","Albany, NY : State University of New York Press, [2017]","ix, 243 pages : illustrations ; 24 cm",Political conventions--United States--Planning; Political conventions--Social aspects--United States; City planning--United States.,,,,,
991011389008904000,9780811739979,1249709140,"Hippensteel, Scott, 1969-, author.","Myths of the Civil War : the fact, fiction and science behind the Civil War's most told stories / Scott Hippensteel.","Guilford, Connecticut : Stackpole Books, [2021]",pages cm,Ballistics--Case studies.,"United States--History--Civil War, 1861-1865--Historiography.;United States--Armed Forces--Firearms--History--19th century.;United States--History--Civil War, 1861-1865--Equipment and supplies.;United States--History--Civil War, 1861-1865--Miscellanea.;United States--History--Errors, inventions, etc.",,,,
991010986789804000,3030008762,1048947771,"Hippensteel, Scott., author.",Rocks and rifles : the influence of geology on combat and tactics during the American Civil War / Scott Hippensteel.,"Cham, Switzerland, Springer, 2019.",,Military geology.,"United States--History--Civil War, 1861-1865.",,,,
991011542106804000,9780816547029,1304812787,"Hoenes del Pinal, Eric, 1975-, author.",Guarded by two jaguars : a Catholic parish divided by language and faith / Eric Hoenes del Pinal.,"Tucson : The University of Arizona Press, [2022]","xiii, 257 pages ; 24 cm",Kekchi Indians--Religion; Catholics--Religious identity--Guatemala--CobaÌn; Kekchi Indians--Social life and customs.,,,,,
991000829669704000,761864326,883647177,"Holloway, Vanessa A., author.",Getting away with murder : the twentieth-century struggle for civil rights in the U.S. Senate / Vanessa A. Holloway.,"Lanham, Maryland : University Press of America, Inc., [2015]","ix, 111 pages ; 23 cm",Civil rights--United States--History; Legislators--United States; African Americans--Civil rights--History.,,,United States. Congress. Senate,,
991001557029704000,9781612058528,910622066,"Hopcroft, Rosemary L. (Rosemary Lynn), 1962-",Evolution and gender : why it matters for contemporary life / Rosemary L. Hopcroft.,"New York ; London : Routledge, Taylor & Francis Group, 2016.","xii, 253 pages ; 23 cm",Sex differences (Psychology); Sex role; Women--Evolution; Human evolution.,,,,,
991006991599704000,9781594518010,471806023,"Hopcroft, Rosemary L. (Rosemary Lynn), 1962-",Sociology : a biosocial introduction / Rosemary L. Hopcroft.,"Boulder : Paradigm Publishers, Â©2010.","xxxiii, 362 pages : illustrations, maps ; 24 cm",Sociology; Sociobiology.,,,,,
991010840050404000,9780190299323,993134196,"Hopcroft, Rosemary L. (Rosemary Lynn), 1962- editor.","The Oxford handbook of evolution, biology, and society / edited by Rosemary L. Hopcroft.","New York, NY : Oxford University Press, [2018]","xvii, 681 pages : illustrations; 26 cm.","Sociobiology--Handbooks, manuals, etc.",,,,,
991011170885804000,9781108482356,1100450513,"Hull, Gordon, 1972-, author.",The biopolitics of intellectual property : regulating innovation and personhood in the information age / Gordon Hull.,"Cambridge, United Kingdom ; New York, NY, USA : Cambridge University Press, 2019.","viii, 223 pages ; 24 cm",Intellectual property--Philosophy; Biopolitics--Philosophy.,,,,,
991011294183704000,9781936970681,1164348772,"Hutchcraft, Allison, author.",Swale / Allison Hutchcraft.,"Kalamazoo, MI : Western Michigan University, 2020.",113 pages ; 22 cm.,,,,,,
991001844409704000,9781138806962,924681725,"Hutchison, Charles B.","Experiences of immigrant professors : cross-cultural differences, challenges, and lessons for success / edited by Charles B. Hutchison.","New York : Routledge, [2016]","xi, 270 pages ; 24 cm.","College teachers, Foreign--Cross-cultural studies; College teaching--Cross-cultural studies.",,,,,
