991002866779704000,9781284112115,974953174,"Issel, L. Michele, author.; Wells, Rebecca, 1966- author.","Health program planning and evaluation : a practical, systematic approach for community health / L. Michele Issel, Rebecca Wells.","Burlington, MA : Jones & Bartlett Learning, [2018]","xxviii, 428 pages ; 23 cm",Health promotion--Planning; Health promotion--Evaluation; Health planning--Methodology; Community health services--United States--Planning; Community health services--United States--Evaluation.,,,,,
991009252149704000,9781284021042,809310108,"Issel, L. Michele.","Health program planning and evaluation : a practical, systematic approach for community health / L. Michele Issel.","Burlington, MA : Jones & Bartlett Learning, Â©2014.","xxxix, 573 pages : illustrations ; 23 cm",Health promotion--Planning; Health promotion--Evaluation; Health planning--Methodology; Community health services--United States--Planning; Community health services--United States--Evaluation.,,,,,
991011467846604000,1476674183,1285771938,"Jackson, Kathy Merlock, 1955- editor; West, Mark I., editor.",Storybook worlds made real : essays on the places inspired by children's narratives / edited by Kathy Merlock Jackson and Mark I. West.,"Jefferson, North Carolina : McFarland & Company, Inc., Publishers, 2022.",282 pages : illustrations ; 23 cm,Imaginary places in literature; Themed environments; Children's literature--History and criticism.,,,,,
991000804369704000,9780786472321,882191848,"Jackson, Kathy Merlock, 1955- editor; West, Mark I., editor.","Walt Disney, from reader to storyteller : essays on the literary inspirations / edited by Kathy Merlock Jackson and Mark I. West.","Jefferson, North Carolina : McFarland & Company, Inc., Publishers, [2015]","viii, 227 pages ; 23 cm",,,"Disney, Walt, 1901-1966--Criticism and interpretation; Disney, Walt, 1901-1966--Knowledge--Literature",,,
991010942085004000,9781476664552,1039611642,"Jackson, Kathy Merlock, 1955- editor; West, Mark I., editor.",Shapers of American childhood : essays on visionaries from I. Frank Baum to Dr. Spock to J.K. Rowling / edited by Kathy Merlock Jackson and Mark I. West.,"Jefferson, North Carolina : McFarland & Company, Inc., [2018]",viii; 278 pages 23cm.,Children--United States--Social conditions--20th century; Children--United States--Social conditions--21st century; Children's literature--History and criticism; Child rearing--United States--History.,,,,,
991011151889704000,9781478006640,1083458562,"James, Robin, 1978-, author.","The sonic episteme : acoustic resonance, neoliberalism, and biopolitics / Robin James.","Durham ; London : University Press, 2019.","viii, 245 pages ; 24 cm",Music--Social aspects--History--21st century; Music--Political aspects--History--21st century.,,,,,
991011020189604000,9780813593791,1044773071,"Johnson, Bethany L., 1981-, author.; Quinlan, Margaret M., author.","You're doing it wrong! : mothering, media, and medical expertise / Bethany L. Johnson, Margaret M. Quinlan.","New Brunswick, New Jersey : Rutgers University Press, [2019]","viii, 259 pages : illustrations : 23 cm",Motherhood; Child rearing; Medical care; Social media.,,,,,
991001037899704000,9781137469861,891610566,"Johnson, David A., 1965-, author.","New Delhi : the last imperial city / David A. Johnson, University of North Carolina, Charlotte, USA.","Houndmills, Basingstoke, Hampshire ; New York, NY : Palgrave Macmillan, 2015.","xv, 261 pages : illustrations, maps ; 23 cm.",Imperialism--Social aspects--India--New Delhi--History--20th century; Politics and culture--India--New Delhi--History--20th century; Public spaces--India--New Delhi--History--20th century; Architecture--Political aspects--India--New Delhi--History--20th century; Social change--India--History--20th century.,"New Delhi (India)--History--20th century.;New Delhi (India)--Colonial influence--History--20th century.;New Delhi (India)--Social life and customs--20th century.;New Delhi (India)--Economic conditions--20th century.;India--History--British occupation, 1765-1947.",,,,
991001292709704000,9781472416193,902599177,"Kanaroglou, Pavlos; Delmelle, Eric; PaÌez, Antonio.","Spatial analysis in health geography / edited by Pavlos Kanaroglou, McMaster University, Canada, Eric Delmelle, University of North Carolina at Charlotte, USA, Antonio PaÌez, McMaster University, Canada.","Farnham, Surrey, UK, England ; Burlington, VT, USA : Ashgate, [2015]","xxii, 321 pages : illustrations, maps ; 24 cm.",Medical geography--Statistical methods.,,,,,
991011540391904000,1666741868,1347784210,"Kaplan, Laura Duhan, author.","Shechinah, bring me home! : Kabbalah and the Omer in real life / Laura Duhan-Kaplan.","Eugene, Oregon : Cascade Books, 2022.","x, 135 pages ; 22 cm",Cabala; Sefirah period; Meditation--Jewish; Mysticism--Judaism.,,,,,
991011325651104000,9781725259058,1255214360,"Kaplan, Laura Duhan, author.",Mouth of the donkey : re-imagining biblical animals / Laura Duhan-Kaplan.,"Eugene, Oregon : Cascade Books, an imprint of Wipf and Stock Publishers, [2021]","ix, 84 pages ; 22 cm",Animals in the Bible; Nature in the Bible; Spiritual life--Judaism; Jewish way of life; Zoology--Palestine.,,,,,
991011258687804000,9781532633300,1154555811,"Kaplan, Laura Duhan, editor; Maier, Harry O., 1959- editor.",Encountering the other : Christian and multifaith perspectives / edited by Laura Duhan-Kaplan and Harry O. Maier.,"Eugene, Oregon : Pickwick Publications, [2020]","xxi, 245 pages ; 23 cm.",Christianity and other religions.,,,,,
991010871889304000,9780814254707,1002677345,"Kashtan, Aaron, author.","Between pen and pixel : comics, materiality, and the book of the future / Aaron Kashtan.","Columbus : The Ohio State University Press, [2018]","xi, 210 pages : illustrations ; 23 cm.","Comic books, strips, etc.--History and criticism; Digital media; Material culture; Cartooning--Technique; Webcomics; Cartoonists--Comic books, strips, etc.",,,,,
991011256813704000,9780367373856,1122882700,"KatoÌ„, Fumie, author.; Spring, Ryan E., editor.",Strategies for growing and enhancing university-level Japanese programs / Fumie Kato ; Ryan E. Spring (editor).,"Abingdon, Oxon ; New York, NY : Routledge, an imprint of the Taylor & Francis Group, 2020.","x, 117 pages : illustrations (black and white) ; 24 cm",Japanese language--Study and teaching (Higher); Second language acquisition--Study and teaching (Higher); Language and languages--Study and teaching (Higher),,,,,
991002175069704000,9781138919112,945885001,"Kellermanns, Franz W., editor; Hoy, Frank, editor.",The Routledge companion to family business / edited by Franz Kellermanns and Frank Hoy.,"New York : Routledge,Taylor & Francis Group, 2017.","xxix, 611 pages ; 26 cm",Family-owned business enterprises; Family corporations.,,,,,
991011508029704000,9781316511466,1296530117,"Kello, John E., author.; Allen, Joseph A., 1981- author.","The burned out physician : managing the stress and reducing the errors / John E. Kello, Joseph A. Allen.","Cambridge ; New York, NY : Cambridge University Press, 2022.",222 pages ; 23 cm,Physicians--Job stress; Physicians--Mental health; Health services administration.,,,,,
991010874978104000,9781433147906,1031408848,"Kelly, Casey Ryan, 1979- editor; Black, Jason Edward, editor.","Decolonizing Native American rhetoric : communicating self-determination / Casey Ryan Kelly and Jason Edward Black, editors.","New York : Peter Lang, [2018]","xvii, 351 pages : illustrations ; 23 cm.",Indians of North America--Government relations; Decolonization; Rhetoric; Indians of North America--Politics and government.,,,,,
991000367529704000,9780199747108,864709556,"Kelly, Michael, 1953- editor.","Encyclopedia of aesthetics / Michael Kelly, editor in chief.","Oxford ; New York : Oxford University Press, [2014]",6 volumes : illustrations ; 29 cm,Aesthetics--Encyclopedias.,,,,,
991011305589804000,9781506368009,1233300611,"Kilmer, Ryan P., editor; Cook, James R., editor.","The practice of evaluation : Partnership approaches for community change / editors, Ryan P. Kilmer, James R. Cook.","Thousand Oaks, California : SAGE Publications, Inc., [2021]","xxiv, 376 pages : illustrations ; 26 cm",Community development--Evaluation; Community leadership.,,,,,
991011472537404000,9780367410469,1265457060,"Kim, Kyoung Hee, author.",Microalgae building enclosures : design and engineering principles / Kyoung Hee Kim.,"New York, NY : Routledge, 2022.","xvii, 253 pages : illustrations (colour) ; 26 cm",Facades--Materials; Microalgae; Algae as building materials; Biofilms; Sustainable buildings--Materials; Buildings--Energy conservation; Sustainable architecture.,,,,,
991002761839704000,9781625310736,967791098,"Kissel, Brian, author.","When writers drive the workshop : honoring young voices and bold choices, K-5 / Brian Kissel ; foreword by Aimee Buckner.","Portland, Maine : Stenhouse Publishers, [2017]","x, 186 pages ; 24 cm",English language--Composition and exercises--Study and teaching (Elementary); Writers' workshops.,,,,,
991011329091104000,3110745410,1245345602,"Klibanov, M. V. (Michael V.), author.; Jingzhi, Li, author.","Inverse problems and Carleman estimates : global uniqueness, global convergence and experimental data / Michael V. Klibanov, Jingzhi Li.","Berlin : De Gruyter, 2021.",325 pages : illustrations ; 25 cm.,Inverse problems (Differential equations)--Numerical solutions; Carleman theorem.,,,,,
991011478646704000,1685075924,1303079430,"Klibanov, M. V. (Michael V.), author.; Li, Jingzhi, author.","Partial differential equations : theory, numerical methods and ill-posed problems / Michael V. Klibanov, and Jingzhi Li.","New York : Nova Science Publishers, 2022.","xii, 347 pages : illustrations (black and white) ; 23cm.","Differential equations--Textbooks; Differential equations, Partial.",,,,,
991011272689804000,1433830590,1145892871,"Kloos, Bret, author.; Hill, Jean (Jean Louise), author; Thomas, Elizabeth (Rubye Elizabeth), author; Case, Andrew D., author; Scott, Victoria C. (Victoria Chien), author; Wandersman, Abraham, author","Community psychology : linking individuals and communities / Bret Kloos, Jean Hill, Elizabeth Thomas, Andrew D. Case, Victoria C. Scott, Abraham Wandersman.","Washington, DC : American Psychological Association, [2021]","xxix, 599 pages : illustrations, 1 map ; 24 cm",Community psychology.,,,,,
991000477389704000,9780874219357,869526616,"Knoblauch, C. H.",Discursive ideologies : reading western rhetoric / C.H. Knoblauch.,"Logan : Utah State University Press, [2014]",208 pages ; 23 cm,Rhetoric--Philosophy; Rhetoric--Political aspects.,,,,,
991002333549704000,1137301708,951609193,"Kropf, Martha E., author.",Institutions and the right to vote in America / Martha E. Kropf.,"New York : Palgrave Macmillan, [2016]",197 pages ; illustrations ; 24 cm.,Elections--United States; Suffrage--United States.,,,,,
991001094799704000,9781483316291,893709414,"Lapp, Diane, author.; Wolsey, Thomas DeVere, author; Wood, Karen D., author.","Mining complex text, grades 2-5 : using and creating graphic organizers to grasp content and share new understandings / Diane Lapp, Thomas DeVere Wolsey, Karen Wood.","Thousand Oaks, California : Corwin Literacy, [2015]","xi, 166 pages : illustrations ; 28 cm","Graphic organizers--United States; Education, Elementary--United States--Graphic methods; Reading comprehension; Content area reading.",,,,,
991001214579704000,9781580442015,898408404,"Larkin, Peter, 1955- editor.",Richard Coer de Lyon / edited by Peter Larkin.,"Kalamazoo : Medieval Institute Publications, Western Michigan University, [2015]","vii, 287 pages ; 26 cm.","Crusades--Poetry; Romances, English.",,"Richard I, King of England, 1157-1199--Romances",,,Richard Coeur de Lion (Romance);
991002676879704000,9781472590466,963439176,"Laroche, Rebecca, author.; Munroe, Jennifer, author.",Shakespeare and ecofeminist theory / Rebecca Laroche and Jennifer Munroe.,"London ; New York, NY : Bloomsbury Arden Shakespeare, an imprint of Bloomsbury Publishing Plc, 2017.","xx, 195 pages ; 21 cm.",Ecofeminism in literature; Ecocriticism in literature; Sex role in literature.,,"Shakespeare, William, 1564-1616--Criticism and interpretation",,,
991010944388604000,,993611935,"Lassiter, Pamela S., editor; Buser, Trevor J., editor.","Annual review of addictions and offender counseling, volume III : best practices / edited by Pamela S. Lassiter & Trevor J. Buser.","Eugene, Oregon : Resource Publications, [2017]",221 pages ; 23 cm.,Criminals--Rehabilitation--United States; Drug addicts--Rehabilitation--United States; Drug addiction; Alcoholics--Rehabilitation--United States; Rehabilitation counseling.,,,,,
991002590759704000,9781506317335,960166643,"Lassiter, Pamela S., editor; Culbreth, John R., editor.","Theory and practice of addiction counseling / [edited by] Pamela S. Lassiter, John R. Culbreth.","Thousand Oaks, California : SAGE Publications, Inc., [2018]","xxv, 397 pages ; 24 cm",Substance abuse--Patients--Counseling of--Case studies.,,,,,
991011027023704000,9781476670034,1089840724,"Lauer, Emily, editor; Basu, Balaka, editor.",The Harry Potter generation : essays on growing up with the series / edited by Emily Lauer and Balaka Basu.,"Jefferson, North Carolina : McFarland & Company, Inc., [2019]","viii, 210 pages ; 23 cm","Fantasy fiction, English--History and criticism.",,"Rowling, J. K.--Criticism and interpretation; Potter, Harry (Fictitious character)",,,
991011006888504000,9781475846997,1051072784,"Leahy, Maria Marsella, author.; Shore, Rebecca, 1957- author.",Journeys of charter school creators : leadership for the long haul / Maria Marsella Leahy and Rebecca Ann Shore ; foreword by Terrence E. Deal ; preface by Guilbert C. Hentschke.,"Lanham, Maryland : Rowman & Littlefield, [2019]","xvi, 114 pages ; 24 cm",Charter schools--United States--Administration; Educational leadership--United States; School management and organization--United States.,,,,,
991000041459704000,9780820328706,852399960,"Leak, Jeffrey B., 1968-",Visible man : the life of Henry Dumas / Jeffrey B. Leak.,"Athens ; London : The University of Georgia Press, [2014]","xi, 195 pages, 10 unnumbered pages of plates : illustrations ; 24 cm","Authors, American--20th century--Biography; African American authors--Biography.","Sweet Home (Pulaski County, Ark.)--Biography.;Harlem (New York, N.Y.)","Dumas, Henry, 1934-1968",,,
991011544071804000,9781538112311,1336990423,"Leeman, Richard W., author.",To reach the nation's ear : a history of African American public speaking / Richard W. Leeman.,"Lanham : Rowman & Littlefield, [2023]","x, 241 pages : illustrations (black and white) ; 24 cm.","African Americans--History--Source; Speeches, addresses, etc., American--African American authors; Political oratory--United States--History.",,,,,
991000103879704000,9780415709514,855264268,"Leicht, Kevin T.; Fitzgerald, Scott T., author.","Middle class meltdown in America : causes, consequences, and remedies / Kevin T. Leicht and Scott T. Fitzgerald.","New York : Routledge/Taylor & Francis Group, 2014.","xv, 188 pages : illustrations ; 24 cm",Middle class--United States; Financial crises--United States; Consumer credit--United States.,United States--Economic conditions--2009-,,,,
991009634889704000,9780135113905,841186887,"Liu, Cheng, 1937-; Evett, Jack B., 1942-","Soils and foundations / Cheng Liu, Jack B. Evett, The University of North Carolina at Charlotte.","Boston : Pearson, [2014]","xii, 270 pages : illustrations ; 29 cm",Soil mechanics--Textbooks; Foundations--Textbooks.,,,,,
991011256480104000,9780822946106,1101972586,"Luckin, Bill, editor; Thorsheim, Peter, editor.","A mighty capital under threat : the environmental history of London, 1800-2000 / edited by Bill Luckin and Peter Thorsheim.","Pittsburgh, Pa. : University of Pittsburgh Press, [2020]","vi, 282 pages ; 24 cm.",Urbanization--England--London.,London (England)--Environmental conditions--19th century.;London (England)--Environmental conditions--20th century.,,,,
991000400709704000,9781421413594,865574845,"Luke, Bob.; Smith, John David, 1949-","Soldiering for freedom : how the Union army recruited, trained, and deployed the U.S. Colored Troops / Bob Luke & John David Smith.","Baltimore : Johns Hopkins University Press, [2014]","x, 131 pages : illustrations ; 24 cm.",African American soldiers--History--19th century.,"United States--History--Civil War, 1861-1865--Participation, African American.",,United States. Colored Troops;United States. Army--African American troops--History--19th century.,,
991000613119704000,9781623965891,876002631,"Ma, Wen; Wang, Chuang (College teacher)","Learner's privilege and responsibility : a critical examination of the experiences and perspectives of learners from Chinese backgrounds in the United States / edited by Wen Ma, Le Moyne College; Chuang Wang, University of North Carolina at Charlotte.","Charlotte, NC : INFORMATION AGE Publishing, Inc., [2014]","xiv, 254 pages ; 24 cm.",Chinese students--United States.,,,,,
991002888249704000,162705684X,978589461,"Maher, Mary Lou, author.; Lee, Lina, author.",Designing for gesture and tangible interaction / Mary Lou Maher and Lina Lee.,"[Willison, VT] : Morgan & Claypool Publishers, [2017]","xvii, 111 pages : color illustrations ; 24 cm.",Human-computer interaction; Ambient intelligence; Ubiquitous computing; Gesture--Data processing.,,,,,
991011024689304000,9780190490997,973733263,"Marks, Jonathan (Jonathan M.), 1955-","The alternative introduction to biological anthropology / Jonathan Marks, the University of North Carolina at Charlotte.","New York : Oxford University Press, 2018.","xix, 283 pages : illustrations ; 24 cm",Physical anthropology.,,,,,
991011328171104000,9781509547463,1203137372,"Marks, Jonathan (Jonathan M.), 1955-, author.",Why are there still creationists? : human evolution and the ancestors / Jonathan Marks.,"Cambridge, UK ; Medford, MA, USA : Polity Press, 2021.","xiv, 150 pages : illustrations ; 23 cm",Creationism; Evolution (Biology); Religion and science.,,,,,
991001385279704000,9780520285811,905419281,"Marks, Jonathan (Jonathan M.), 1955-, author.",Tales of the ex-apes : how we think about human evolution / Jonathan Marks.,"Oakland, California : University of California Press, [2015]","xiii, 220 pages : illustrations ; 21 cm",Social evolution; Human evolution.,,,,,
991002634879704000,9780745689210,961801723,"Marks, Jonathan (Jonathan M.), 1955-, author.",Is science racist? / Jonathan Marks.,"Malden, MA : Polity, 2017.","viii, 142 pages ; 20 cm.",Social sciences--Moral and ethical aspects; Science--Moral and ethical aspects; Race discrimination.,,,,,
991011168356204000,9781799803232,1110655950,"Martin, Christie, author.; Polly, Drew, 1977- author; Lambert, Richard, author.","Handbook of research on formative assessment in pre-k through elementary classrooms / Christie Martin, University of South Carolina, USA, Drew Polly, University of South Carolina, Charlotte, USA, and Richard Lambert, University of South Carolina, Charlotte, USA.","Hershey, PA : Information Science Reference, [2020]","xx, 438 pages : illustrations 29 cm","Educational tests and measurements; Education, Elementary; Educational evaluation.",,,,,
991011389008704000,1612942156,1252412752,"Martinac, Paula, 1954-, author.",Dear Miss Cushman / Paula Martinac.,"Ann Arbor, MI : Bywater Books, 2021.",258 pages ; 22 cm,Actresses--Fiction; Theater--Fiction.,,,,,
991011290985604000,1612941796,1140382440,"Martinac, Paula, 1954-, author.",Testimony / Paula Martinac.,"Ann Arbor, Michigan : Bywater Books, 2021.",305 pages ; 22 cm,Women college teachers--Fiction; Nineteen sixties--Fiction; University towns--Virginia--Fiction; Homosexuality--Moral and ethical aspects--Fiction.,,,,,
991011257284804000,9781482238686,1099840161,"Mase, George Thomas, author.; Smelser, Ronald E., author; Rossmann, Jenn Stroud, author.","Continuum mechanics for engineers  / G. Thomas Mase, Ronald E. Smelser, Jenn Stroud Rossmann.","Boca Raton : CRC Press, 2020.",434 pages : illustrations (black and white) ; 27 cm.,Continuum mechanics.,,,,,
991011115622704000,9781785335983,996401292,"Massino, Jill, author.","Ambiguous transitions : gender, the state, and everyday life in socialist and postsocialist Romania / Jill M. Massino.","New York : Berghahn Books, [2019]","xii, 453 pages ; 24 cm",Gender identity--Romania; Women--Romania--Social conditions; Women and communism--Romania--History.,Romania--History--1944-1989.;Romania--History--1989-,,,,
991000141489704000,9781618211057,856860989,"Matthews, Michael S., 1968- editor; Castellano, Jaime A., editor.","Talent development for English language learners : identifying and developing potential / edited by Michael S. Matthews, Ph. D. & Jaime A. Castellano, Ed. D.","Waco, Texas : Prufrock Press Inc., [2014]","x, 234 pages ; 23 cm","English language--Ability testing--Evaluation; Literacy--Ability testing--Evaluation; Language acquisition--Ability testing--Evaluation; Communicative competence; English language--Study and teaching--Foreign speakers--Evaluation; Education, Bilingual.",,,,,
991001086619704000,9780190205355,893455323,"McCloud, Sean.",American possessions : fighting demons in the contemporary United States / Sean McCloud.,"New York : Oxford University Press, [2015]","xi, 175 pages ; 25 cm",Demoniac possession--United States; Spiritual warfare--United States.,,,,,
991002871219704000,9781138221444,975369234,"McEachnie, Robert, author.",Chromatius of Aquileia and the making of a Christian city / Robert McEachnie.,"Abingdon, Oxon ; New York, NY : Routledge, 2017.","ix, 194 pages : illustrations, maps ; 24 cm.",Cities and towns--Religious aspects--Christianity.,Aquileia (Italy)--Church history.;Aquileia (Italy)--History.;Aquileia (Italy)--Antiquities.,"Chromatius, Saint, -407.",,,
991010811051604000,9781498535069,1014101256,"McGowan Shepherd, Mary Jo, author.",Campaign finance complexity : before campaigning retain an attorney / Mary Jo McGowan Shepherd.,"Lanham, Maryland : Lexington Books, [2018]","xv, 183 pages ; 24 cm",Campaign funds--Law and legislation--United States; Election law--United States.,,,,,
991000699799704000,9781617118173,880245877,"McKeon, Patrick O. (Patrick Owen), 1975- editor; Wikstrom, Erik, 1978- editor.","Quick questions in ankle sprains : expert advice in sports medicine / editors, Patrick O. McKeon, P hD, ATC, CSCS, Assistant Professor, Department of Exercise & Sports Sciences, Ithaca College, Ithaca, New York ; Erik Wikstrom, PhD, ATC, FACSM, Associate Professor, Department of Kinesiolgy, University of North Carolina at Charlotte, Charlotte, North Carolina ; Series editor, Eric L. Sauers, PhD, ATC, FNATA, Professor and Chair, Department of Interdisciplinary Health Sciences, Arizona School of Health Sciences A.T. Still University, Mesa, Arizona.","Thorofare, NJ : SLACK Incorporated, [2015]","xxvi, 220 pages : illustrations ; 26 cm.",Ankle--Wounds and injuries--Treatment; Sports medicine.,,,,,
991011177689804000,9781641136440,1110126089,"McMahon, Brenda J., editor; Merriweather, Lisa R., editor.",Convictions of conscience : how voices from the margins inform public actions and educational leadership / edited by Brenda J. McMahon and Lisa R. Merriweather.,"Charlotte, NC : IAP, Information Age Publishing, Inc., [2019]","xxix, 203 pages ; 24 cm.",Educational leadership--Social aspects; Culturally relevant pedagogy; Educational equalization.,,,,,
991001557239704000,9781498513159,910622097,"McReynolds, Phillip, author.",The American philosopher : interviews on the meaning of life and truth / Phillip McReynolds.,"Lanham : Lexington Books, [2015]","xix, 289 pages ; 24 cm.","Philosophy, American--20th century.",,,,,
991011115677904000,9781433131585,945767568,"Meadows, Karen, author.",Pedagogy of survival : the narratives of Millicent E. Brown and Josephine Boyd Bradley / Karen Meadows.,"New York : Peter Lang, [2016]","xxvi, 211 pages ; 23 cm.",School integration--United States.,,"Brown, Millicent E.; Boyd Bradley, Jennifer.",,,
991011266024204000,9783030376963,1159239932,"Mellanby, Kenneth, author.; Rasmussen, Lisa M., editor.","Human guinea pigs, by Kenneth Mellanby : a reprint with commentaries / Lisa M. Rasmussen, editor.","Cham, Switzerland : Springer Nature, [2020]","xviii, 214 pages ; 25 cm.",Scabies; Conscientious objectors.,,,,,
991011273584604000,9781604699913,1105228013,"Mellichamp, Larry, author.; Gross, Paula, author; Stuart, Will, photographer.",The southeast native plant primer : 225 plants for an earth-friendly garden / Larry Mellichamp and Paula Gross ; photographs by Will Stuart.,"Portland, Oregon : Timber Press, Inc., 2020.",255 pages : color illustrations ; 23 cm,Native plants for cultivation--Southern States; Native plant gardening--Southern States.,,,,,
991009623109704000,9781604693232,840463055,"Mellichamp, Larry.; Stuart, Will.",Native plants of the Southeast : a comprehensive guide to the best 460 species for the garden / Larry Mellichamp ; photographs by Will Stuart.,"Portland, Or. : Timber Press, 2014.",367 p.  : col. ill. ; 28 cm.,Native plants for cultivation--Southern States; Native plant gardening--Southern States.,,,,,
991001916579704000,9781138124950,929917621,"Mellinger, Christopher D. (Christopher Davey), author.; Hanson, Thomas A., author.",Quantitative research methods in translation and interpreting studies / Christopher D. Mellinger and Thomas A. Hanson.,"Milton Park, Abingdon, Oxon ; New York, NY : Routledge, 2017.","xvii, 275 pages : illustrations ; 24 cm",Translating and interpreting--Study and teaching--Research; Translating and interpreting--Study and teaching--Methodology; Translating and interpreting--Research; Quantitative research.,,,,,
